{
  "type": "plan",
  "id": "CLV-45",
  "project": "CLV",
  "status": "gate-pending",
  "owner": {
    "kind": "agent",
    "id": "plan"
  },
  "parent_rfc": {
    "project": "CLV",
    "id": "CLV-44"
  },
  "task_dag": {
    "nodes": [
      {
        "project": "CLV",
        "id": "CLV-46"
      },
      {
        "project": "CLV",
        "id": "CLV-47"
      },
      {
        "project": "CLV",
        "id": "CLV-48"
      },
      {
        "project": "CLV",
        "id": "CLV-49"
      }
    ],
    "edges": [
      {
        "from": {
          "project": "CLV",
          "id": "CLV-46"
        },
        "to": {
          "project": "CLV",
          "id": "CLV-49"
        }
      },
      {
        "from": {
          "project": "CLV",
          "id": "CLV-47"
        },
        "to": {
          "project": "CLV",
          "id": "CLV-49"
        }
      },
      {
        "from": {
          "project": "CLV",
          "id": "CLV-48"
        },
        "to": {
          "project": "CLV",
          "id": "CLV-49"
        }
      }
    ]
  },
  "tasks": [
    {
      "type": "task",
      "id": "CLV-46",
      "project": "CLV",
      "status": "pending",
      "owner": {
        "kind": "agent",
        "id": "implementer"
      },
      "title": "install.sh --with-cross-browser flag",
      "context": {
        "rfc": {
          "project": "CLV",
          "id": "CLV-44"
        },
        "spikes": [
          {
            "project": "CLV",
            "id": "CLV-41"
          }
        ]
      },
      "definition_of_done": [
        "`--with-cross-browser` flag parsed from `\"$@\"` at the top of `reference-impl/install.sh`",
        "When flag is present on Linux, `npx playwright install-deps webkit firefox` is invoked instead of `npx playwright install-deps webkit`",
        "When flag is absent, existing webkit-only behavior is preserved unchanged",
        "When flag is absent, an informational note is printed explaining how to enable cross-browser support",
        "Shell-mock regression test added under `reference-impl/tests/` or `reference-impl/scripts/` covering both flag-present and flag-absent code paths"
      ],
      "acceptance_criteria": [
        "Running `install.sh --with-cross-browser` on Linux installs both webkit and firefox Playwright deps without error",
        "Running `install.sh` without the flag installs webkit deps only and prints the informational note",
        "Regression test passes without external network access (shell mocking / stubs) and is runnable in CI"
      ],
      "risk_class": "high"
    },
    {
      "type": "task",
      "id": "CLV-47",
      "project": "CLV",
      "status": "pending",
      "owner": {
        "kind": "agent",
        "id": "implementer"
      },
      "title": ".gitattributes merge=union for reference-impl/CHANGELOG.md",
      "context": {
        "rfc": {
          "project": "CLV",
          "id": "CLV-44"
        }
      },
      "definition_of_done": [
        "`reference-impl/CHANGELOG.md merge=union` line is present in `.gitattributes` at the repo root (file created if absent; any existing lines preserved verbatim)",
        "Regression test simulates two branches each appending a distinct `## [Unreleased]` bullet, performs a merge, then asserts both bullets are present in the result and no conflict markers (`<<<<<<<`, `=======`, `>>>>>>>`) appear"
      ],
      "acceptance_criteria": [
        "After merging two branches with concurrent distinct CHANGELOG bullets, both entries are present and no conflict markers exist in the file",
        "Any pre-existing lines in `.gitattributes` are not removed or altered by the change",
        "Regression test passes in CI"
      ],
      "risk_class": "high"
    },
    {
      "type": "task",
      "id": "CLV-48",
      "project": "CLV",
      "status": "pending",
      "owner": {
        "kind": "agent",
        "id": "implementer"
      },
      "title": "Session B CWD drift fix in SKILL.md and agent prompts",
      "context": {
        "rfc": {
          "project": "CLV",
          "id": "CLV-44"
        }
      },
      "definition_of_done": [
        "`reference-impl/skills/cloverleaf-run-plan/SKILL.md` Session B scenario brief embeds the absolute `$WORKTREE_ROOT` variable and includes `cd \"$WORKTREE_ROOT\"` as the first preflight instruction in that scenario",
        "`prompts/implementer.md` gains `cd \"$(git rev-parse --show-toplevel)\"` as its first executable line",
        "`prompts/documenter.md` gains `cd \"$(git rev-parse --show-toplevel)\"` as its first executable line",
        "`prompts/reviewer.md` gains `cd \"$(git rev-parse --show-toplevel)\"` as its first executable line",
        "`prompts/ui-reviewer.md` gains `cd \"$(git rev-parse --show-toplevel)\"` as its first executable line",
        "`prompts/qa.md` gains `cd \"$(git rev-parse --show-toplevel)\"` as its first executable line"
      ],
      "acceptance_criteria": [
        "A Session B subagent launched from an arbitrary working directory will execute `cd \"$WORKTREE_ROOT\"` before any task steps as specified in SKILL.md",
        "Each of the five agent prompts contains `cd \"$(git rev-parse --show-toplevel)\"` as the first executable instruction, verifiable by grep",
        "SKILL.md Session B scenario brief references `$WORKTREE_ROOT` explicitly in the brief text"
      ],
      "risk_class": "high"
    },
    {
      "type": "task",
      "id": "CLV-49",
      "project": "CLV",
      "status": "pending",
      "owner": {
        "kind": "agent",
        "id": "implementer"
      },
      "title": "Release prep: CHANGELOG, package.json v0.6.2, tag, GitHub Release, npm publish",
      "context": {
        "rfc": {
          "project": "CLV",
          "id": "CLV-44"
        }
      },
      "definition_of_done": [
        "`reference-impl/CHANGELOG.md` `## [Unreleased]` section renamed to `## 0.6.2 — 2026-04-27` and bullet order normalized if interleaved by merge=union",
        "`## 0.6.2 — 2026-04-27` section lists all three fixes: install.sh cross-browser flag, merge=union CHANGELOG strategy, and Session B CWD drift fix",
        "`reference-impl/package.json` version field bumped from `0.6.1` to `0.6.2`",
        "Git tag `reference-impl-v0.6.2` created and pushed",
        "GitHub Release published for tag `reference-impl-v0.6.2` with release notes drawn from the CHANGELOG section",
        "`npm publish` executed for the `reference-impl` package at version `0.6.2`"
      ],
      "acceptance_criteria": [
        "`reference-impl/CHANGELOG.md` contains a `## 0.6.2 — 2026-04-27` section with entries for all three CLV-44 fixes and no `## [Unreleased]` section remains",
        "`reference-impl/package.json` reports `\"version\": \"0.6.2\"`",
        "`git tag` output includes `reference-impl-v0.6.2`",
        "GitHub Release page for `reference-impl-v0.6.2` is publicly visible with release notes",
        "npm registry shows version `0.6.2` of the reference-impl package as the latest published release"
      ],
      "risk_class": "high"
    }
  ]
}
